"","titulo","precio","lugar","dimensiones_m2","habitaciones","baños","amueblado","parking","trastero","balTerraza","caracteristicas A","caracteristicas B","descripcion"
"30","Alquiler piso aire acondicionado Centro Ref: 2017083","375","Centro - Puertollano","52","1","1",1,0,0,0,"Amueblado
Cocina equipada
Aire acondicionado","Ascensor","Apartamento con pocos años de construcción, en el centro de Puertollano, a pocos metros del paseo, interior a un patio de luces amplio y que permite que entre bastante luz lo que lo hace muy luminoso, en calle peatonal, a menos de 5 minutos a pie del paseo y ayuntamiento. La vivienda dispone de un dormitorio y un baño con ducha de hidromasaje. La vivienda se encuentra totalmente amueblada. Calefacción individual, aire acondicionado. Edificio con ascensor. Comunidad incluida en el precio. No lo dude y visite. GESTIONA REAL ESTATE te ofrece todos los servicios necesarios para que puedas alquilar y vender tu inmueble en el menor tiempo posible, maximizamos tu tiempo y tu rentabilidad EXPERIENCIA real de muchos años, trabajo transparente y serio. La felicidad con nuestros clientes y la excelencia en nuestro trabajo es la garantía de tu éxito. Si podemos AYUDARLE en algo consulte sin compromiso, nos adaptamos a sus necesidades. Sin moverte de casa! Aprovecha nuestras visitas virtuales y videollamadas y podrás ver la vivienda en directo. ¡BIENVENIDO A LA DIFERENCIA! ""Más info en www.gestionarealestate.es o en el teléfono 926415076."
"31","¡Gran Oportunidad de Alquiler en el Centro de Puertollano! Ref: 2017933","375","El Poblado - Abulagar - Puertollano","60","1","1",1,0,0,0,"Amueblado
Cocina equipada","","Te presentamos esta acogedora vivienda en el corazón del centro de Puertollano. Esta propiedad ofrece comodidad y conveniencia en un lugar privilegiado, y la calefacción está incluida en el precio, brindándote una gran ventaja en los meses más fríos. La vivienda consta de un dormitorio, lo que la convierte en una elección ideal para parejas o personas solteras que buscan un espacio acogedor. El baño cuenta con una bañera para tu relajación y comodidad. La cocina está totalmente equipada con todo lo que necesitas para cocinar tus comidas, lo que te ahorra tiempo y esfuerzo. Además, el piso se entrega completamente amueblado, lo que significa que puedes mudarte de inmediato sin preocuparte por la decoración. La ubicación en el centro de Puertollano te brinda acceso a una amplia variedad de servicios, tiendas y restaurantes, lo que facilita tu vida diaria y te ofrece muchas opciones de entretenimiento. GESTIONA REAL ESTATE te ofrece todos los servicios necesarios para que puedas alquilar y vender tu inmueble en el menor tiempo posible, maximizamos tu tiempo y tu rentabilidad EXPERIENCIA real de muchos años, trabajo transparente y serio. La felicidad con nuestros clientes y la excelencia en nuestro trabajo es la garantía de tu éxito. Si podemos AYUDARLE en algo consulte sin compromiso, nos adaptamos a sus necesidades. Sin moverte de casa! Aprovecha nuestras visitas virtuales y videollamadas y podrás ver la vivienda en directo. ¡BIENVENIDO A LA DIFERENCIA! ""Más info en www.gestionarealestate.es o en el teléfono 926415076."
"32","Alquiler piso ascensor Centro Ref: 2017126","650","Centro - Puertollano","115","4","2",1,0,0,0,"Amueblado
Cocina equipada","Ascensor","IDEAL ESTUDIANTES. CALEFACCIÓN+COMUNIDAD INCLUIDA EN EL PRECIO. Piso completamente amueblado en el Paseo San Gregorio con excelentes vistas. Inmueble con cuatro dormitorios, dos baños ambos con bañera, salón con balcón exterior con terraza, cocina equipada con lavadero. Piso con calefacción central y comunidad, ambas incluida en el precio. La vivienda cuenta con suelo de parquet, ventanas de aluminio.. . Edificio con ascensor. GESTIONA REAL ESTATE te ofrece todos los servicios necesarios para que puedas alquilar y vender tu inmueble en el menor tiempo posible, maximizamos tu tiempo y tu rentabilidad EXPERIENCIA real de muchos años, trabajo transparente y serio. La felicidad con nuestros clientes y la excelencia en nuestro trabajo es la garantía de tu éxito. Si podemos AYUDARLE en algo consulte sin compromiso, nos adaptamos a sus necesidades. Sin moverte de casa! Aprovecha nuestras visitas virtuales y videollamadas y podrás ver la vivienda en directo. ¡BIENVENIDO A LA DIFERENCIA! ""Más info en www.gestionarealestate.es o en el teléfono 926415076."
"33","Ref. A618 se alquila piso amueblado Ref: REF.A618","400","Ctra De Córdoba - Libertad - Puertollano","90","3","1",0,0,0,1,"Terraza","Amueblado
Cocina equipada
Calefacción","Se alquila vivienda en C/ Gran Capitán, zona centro, a 2 min del Paseo San Gregorio, junto a todo tipo de servicios, se compone de 3 amplios dormitorios, 1 cuarto de baño con bañera, suelo de tarima, cocina equipada (horno, microondas, placa de gas...), terraza cerrada lavadero, amplio salón con terraza, calefacción gas natural individual, edificio con ascensor. CONTACTO: *657*692*599* // *926*423*223*."
"34","Piso de 2 dormitorios con garaje incluido en ciudad real Ref: 1041ACR","700","Centro - El Pilar - Ciudad Real","80","2","1",0,1,0,0,"Parking","Amueblado
Cocina equipada","Te presentamos este excepcional piso recién reformado en Calle Bernardo Mulleras, ubicado en el corazón de Ciudad Real. Este hogar ofrece la combinación perfecta de comodidad y estilo, en una ubicación inmejorable. El piso ha sido completamente renovado, brindándote un espacio moderno y acogedor para vivir. Cuenta con todas las comodidades que necesitas para disfrutar de la vida urbana en su máxima expresión. En su interior, encontrarás una cocina equipada con electrodomésticos y mobiliario nuevos de alta calidad. La calefacción por conducto mantendrá tu hogar cálido durante los meses más fríos, mientras que los amplios ventanales permiten que la luz natural inunde cada rincón del espacio. Este piso es especialmente luminoso y se encuentra en pleno centro de Ciudad Real, cerca de tiendas, restaurantes, parques y todas las comodidades que la ciudad tiene para ofrecer. Además, cuenta con ascensor y garaje incluido, lo que hace que tu vida diaria sea aún más cómoda. El alojamiento se distribuye en 2 dormitorios espaciosos, con armarios empotrados de gran capacidad para un almacenamiento conveniente y organizado. El cuarto de baño cuenta con una bañera y una mampara elegante y funcional. El precio de alquiler es de 700 euros al mes, con el garaje incluido en el precio. Si desea más información o consultar otros inmuebles visite nuestra web Gestionarealestate. es."
"35","¡Gran Oportunidad! Piso Totalmente Reformado en Calle Pedrera Baja, Ciudad Real Ref: 1042ACR","880","Santa María - Ciudad Real","80","4","2",1,0,0,0,"Amueblado
Cocina equipada
Aire acondicionado","","¡Gran Oportunidad! Piso Totalmente Reformado en Calle Pedrera Baja, Ciudad Real Te presentamos una verdadera joya en Calle Pedrera Baja, Ciudad Real. Este piso totalmente reformado combina a la perfección el confort y la ubicación conveniente, ofreciéndote un espacio ideal para vivir. Este amplio piso cuenta con cuatro dormitorios, lo que lo convierte en la elección perfecta para una familia grande o para aquellos que deseen tener espacio adicional para oficinas o sala de estudio. La calefacción de gas natural asegura que disfrutes de un ambiente cálido y acogedor en todo momento. El interior de la propiedad ha sido completamente renovado, y se presenta con mobiliario nuevo, lo que significa que puedes mudarte de inmediato sin preocuparte por la decoración. Además, cuenta con un lavadero y un patio privativo, proporcionando un espacio adicional para tus necesidades diarias. La ubicación es inmejorable, ya que se encuentra cerca de la universidad y justo enfrente de un supermercado, lo que facilita tus compras y el acceso a la educación superior. Los armarios empotrados te brindan una solución de almacenamiento conveniente y organizada, y el aire acondicionado asegura tu comodidad durante los días más calurosos. El piso también cuenta con dos baños completos, lo que significa que no tendrás que esperar para utilizar el baño. Si desea más información o consultar otros inmuebles visite nuestra web Gestionarealestate. es."
"36","Ref. B169. Alquiler piso económico en almodóvar del campo. Ref: REF. B169","300","Almodovar del Campo","80","3","2",0,0,0,0,"Cocina equipada","2a planta de 2 plantas
Ascensor","Casainnova Gestión Inmobiliaria, alquila piso económico en Almodóvar del Campo. La vivienda consta de tres dormitorios, un baño con bañera y un aseo, amplio salón muy luminoso, cocina con mobiliario actual en muy buen estado, equipada con todos los electrodomésticos necesarios. Solicite información en C/ Ancha, 10. Teléf. 926 423 223- Móvil 657 692 599."
"37","Casa en alquiler en puertollano Ref: 2017485","500","Centro - Puertollano","136","3","2",0,0,1,0,"Trastero","Amueblado
Cocina equipada
Aire acondicionado","La vivienda consta de 136 metros cuadrados con muy buena ubicación y de las zonas más tranquilas de la localidad. Ubicada en zona centro muy próxima a todo tipo de servicios. Los baños están totalmente completos y la cocina se encuentra completamente amueblada. En la primera planta cuenta con: salita, trastero, salón, patio de unos seis metros cuadrados, cocina y baño. En la segunda planta, se encuentra con baño totalmente completo y tres dormitorios. La casa es exterior y muy luminosa. Calefacción individual. Aire acondicionado. Cocina con vitrocerámica y lavadero cerrado. Suelos de gres. Adaptado completamente a personas de movilidad reducida con silla salva escaleras. GESTIONA REAL ESTATE te ofrece todos los servicios necesarios para que puedas alquilar y vender tu inmueble en el menor tiempo posible, maximizamos tu tiempo y tu rentabilidad EXPERIENCIA real de muchos años, trabajo transparente y serio. La felicidad con nuestros clientes y la excelencia en nuestro trabajo es la garantía de tu éxito. Si podemos AYUDARLE en algo consulte sin compromiso, nos adaptamos a sus necesidades. Sin moverte de casa! Aprovecha nuestras visitas virtuales y videollamadas y podrás ver la vivienda en directo. ¡BIENVENIDO A LA DIFERENCIA! ""Más info en https://gestionarealestate.es/ o en el teléfono 926415076.."
"38","Piso de 3 dormitorios en puertollano Ref: 2017926","450","Centro - Puertollano","80","3","2",1,0,0,0,"Amueblado
Cocina equipada","","Piso de obra nueva de 3 dormitorios, y 2 baños, un baño con bañera y el otro baño con plato de ducha, completamente amueblado. Cocina totalmente equipada. Calefacción individual de Gas Natural. POSIBILIDAD DE GARAJE POR 55? GESTIONA REAL ESTATE te ofrece todos los servicios necesarios para que puedas alquilar y vender tu inmueble en el menor tiempo posible, maximizamos tu tiempo y tu rentabilidad EXPERIENCIA real de muchos años, trabajo transparente y serio. La felicidad con nuestros clientes y la excelencia en nuestro trabajo es la garantía de tu éxito. Si podemos AYUDARLE en algo consulte sin compromiso, nos adaptamos a sus necesidades. Sin moverte de casa! Aprovecha nuestras visitas virtuales y videollamadas y podrás ver la vivienda en directo. ¡BIENVENIDO A LA DIFERENCIA! ""Más info en www.gestionarealestate.es o en el teléfono 926415076."
"39","Piso de 2 dormitorios en ciudad real Ref: 1039ACR","600","Centro - El Pilar - Ciudad Real","80","2","1",1,0,0,0,"Amueblado
Cocina equipada","Ascensor","La vivienda está dotada de muebles de gran calidad y capacidad, también tiene: Conserje, video portero, ascensor, puerta acorazada, tarima flotante, puertas de paso chapadas en roble, aislamientos con doble ventana al exterior y doble acristalado con laminado plástico entre ambos cristales en las ventanas interiores. Es muy luminoso y confortable, no tiene edificios frente a las ventanas que dan al exterior de la calle Maternidad que tiene una anchura de gran amplitud. Es una calle cortada y la circulación de vehículos no se percibe, tampoco tiene ruidos molestos vecinales por lo que toda la estancia resulta muy confortable. GESTIONA REAL ESTATE te ofrece todos los servicios necesarios para que puedas alquilar y vender tu inmueble en el menor tiempo posible, maximizamos tu tiempo y tu rentabilidad EXPERIENCIA real de muchos años, trabajo transparente y serio. La felicidad con nuestros clientes y la excelencia en nuestro trabajo es la garantía de tu éxito. Si podemos AYUDARLE en algo consulte sin compromiso, nos adaptamos a sus necesidades. Sin moverte de casa! Aprovecha nuestras visitas virtuales y videollamadas y podrás ver la vivienda en directo. ¡BIENVENIDO A LA DIFERENCIA! ""Más info en www.gestionarealestate.es o en el teléfono 926415076."
"40","Piso en Alquiler en Tomelloso, Ciudad Real Ref: 6669E","450","Tomelloso","98","3","1",0,0,0,0,"Cocina equipada
Aire acondicionado","Jardín","REFERENCIA: 6669E Se alquila piso amueblado muy céntrico en Tomelloso, Ciudad Real. Está situado próximo a Don Víctor Peñasco y tiene una superficie de 100 m2. que se distribuyen en 3 habitaciones, 1 baño, un amplio salón con balcón, cocina con cuarto de desahogo y garaje. La vivienda se encuentra en perfecto estado, dispone de ventanas de doble acristalamiento, puerta de seguridad y suelos de mármol. El edificio cuenta con ascensor. La plaza de garaje está incluido en el precio."
"41","Alquiler piso ascensor y aire acondicionado Ref: 15200","450","Tomelloso","135","3","2",0,0,0,1,"Balcón","Cocina equipada
Aire acondicionado","Piso en alquiler en una de las mejores zonas de Tomelloso, Paseo San Isidro. Cercano a supermercados, parques, zonas verdes, centros médicos, colegios, zonas de ocio, etc. Cuenta con 123m2 de superficie, divididos en tres habitaciones dobles con armarios empotrados, dos baños, cocina equipada, cuarto de la lavadora y despensa. Un enorme salón con terraza. Lo mejor de todo es que tiene unas calidades excepcionales, parquet de alta calidad y carpintería exterior de aluminio, totalmente climatizado. Aire acondicionado, ascensor y edificio adaptado para minusválidos. A parte dentro del precio del alquiler incluye garaje, y la comunidad. La vivienda está sin amueblar Solicita información sin compromiso y venga a visitarlo sin ningún tipo de compromiso. No pierda la oportunidad de hacer suya esta lujosa vivienda. Para conocer más inmuebles como este visite nuestra página web oficial: www.gfima.es Lo que más amo de mi casa es con quien la comparto. Compártela con nosotros."
"42","Ático de 4 dormitorios y 2 baños. en Almodóvar del campo Ref: 2015456","380","Almodovar del Campo","100","4","2",1,0,0,0,"Amueblado
Cocina equipada
Aire acondicionado","","Ático en Almódovar del campo, exterior, muy luminoso. cuatro dormitorios y dos baños. la vivienda se encuentra totalmente amueblada y equipada, cocina independiente del salón totalmente amueblada y equipada. dos terrazas. calefacción individual. aire acondicionado de frío y calor. posibilidad de alquilar cochera por 40 ? mas. GESTIONA REAL ESTATE te ofrece todos los servicios necesarios para que puedas alquilar y vender tu inmueble en el menor tiempo posible, maximizamos tu tiempo y tu rentabilidad EXPERIENCIA real de muchos años, trabajo transparente y serio. La felicidad con nuestros clientes y la excelencia en nuestro trabajo es la garantía de tu éxito. Si podemos AYUDARLE en algo consulte sin compromiso, nos adaptamos a sus necesidades. Sin moverte de casa! Aprovecha nuestras visitas virtuales y videollamadas y podrás ver la vivienda en directo. ¡BIENVENIDO A LA DIFERENCIA! ""Más info en www.gestionarealestate.es o en el teléfono 926415076."
"43","En venta Piso en Paseo de San Gregorio Ref: 2017915","450","Centro - Puertollano","88","2","2",0,0,0,1,"Balcón
Terraza","Amueblado
Cocina equipada","Acogedor piso en alquiler de dos dormitorios en el corazón de Puertollano. Este luminoso y céntrico apartamento ofrece comodidad y conveniencia. Cuenta con amplias habitaciones, una cocina completamente equipada y un acogedor salón. Además, se encuentra cerca de tiendas, restaurantes y transporte público, lo que facilita la vida diaria. No pierdas la oportunidad de vivir en este encantador piso en una ubicación inmejorable. GESTIONA REAL ESTATE te ofrece todos los servicios necesarios para que puedas alquilar y vender tu inmueble en el menor tiempo posible, maximizamos tu tiempo y tu rentabilidad EXPERIENCIA real de muchos años, trabajo transparente y serio. La felicidad con nuestros clientes y la excelencia en nuestro trabajo es la garantía de tu éxito. Si podemos AYUDARLE en algo consulte sin compromiso, nos adaptamos a sus necesidades. Sin moverte de casa! Aprovecha nuestras visitas virtuales y videollamadas y podrás ver la vivienda en directo. ¡BIENVENIDO A LA DIFERENCIA! ""Más info en www.gestionarealestate.es o en el teléfono 926415076."
"44","Piso en alquiler en paseo san gregorio Ref: 2017816","525","Centro - Puertollano","120","4","2",1,0,0,0,"Amueblado
Cocina equipada","","Gestiona Real Estate le ofrece la oportunidad de un piso de alquiler en Paseo san Gregorio, Puertollano, Ciudad Real. Se trata de un piso de 120 metros cuadrados exterior, muy luminoso, en pleno centro de Puertollano. La vivienda cuenta con 4 amplias habitaciones (una de ellas destinada a despacho), cocina totalmente equipada con electrodomésticos y 2 cuartos de baño completos con plato de ducha. Tiene aire acondicionado. Totalmente reformado, muebles y electrodomésticos a estrenar. GESTIONA REAL ESTATE te ofrece todos los servicios necesarios para que puedas alquilar y vender tu inmueble en el menor tiempo posible, maximizamos tu tiempo y tu rentabilidad EXPERIENCIA real de muchos años, trabajo transparente y serio. La felicidad con nuestros clientes y la excelencia en nuestro trabajo es la garantía de tu éxito. Si podemos AYUDARLE en algo consulte sin compromiso, nos adaptamos a sus necesidades. Sin moverte de casa! Aprovecha nuestras visitas virtuales y videollamadas y podrás ver la vivienda en directo. ¡BIENVENIDO A LA DIFERENCIA!"
"45","Piso de 2 dormitorios en puertollano Ref: 2017923","390","Centro - Puertollano","65","2","1",0,0,0,1,"Terraza","Amueblado
Cocina equipada","Apartamento en calle Santa Ana ascensor de dos dormitorios, un baño y cocina Independiente. Calefacción de Gas Natural. Terraza privada en la 3ª planta. GESTIONA REAL ESTATE te ofrece todos los servicios necesarios para que puedas alquilar y vender tu inmueble en el menor tiempo posible, maximizamos tu tiempo y tu rentabilidad EXPERIENCIA real de muchos años, trabajo transparente y serio. La felicidad con nuestros clientes y la excelencia en nuestro trabajo es la garantía de tu éxito. Si podemos AYUDARLE en algo consulte sin compromiso, nos adaptamos a sus necesidades. Sin moverte de casa! Aprovecha nuestras visitas virtuales y videollamadas y podrás ver la vivienda en directo. ¡BIENVENIDO A LA DIFERENCIA! ""Más info en www.gestionarealestate.es o en el teléfono 926415076."
"46","Piso en Alquiler en Tomelloso, Ciudad Real Ref: 66461","380","Tomelloso","70","2","1",0,0,0,0,"Cocina equipada
Aire acondicionado","Ascensor
Jardín","Referencia: 66461 en alquiler, piso amueblado de dos habitaciones, 1 baño, salón, cocina y balcón. Una vivienda nueva en avenida juan carlos i. Opción de alquilar plaza de garaje en el mismo edificio. El precio con garaje incluido es de 430"
"47","Piso en Almodóvar Ref: 2017872","450","Almodovar del Campo","90","3","1",1,0,0,0,"Amueblado
Cocina equipada","","Piso en Almodóvar. 3 dormitorios 1, baño, calefacción individual de gasoil, plato de ducha. GESTIONA REAL ESTATE te ofrece todos los servicios necesarios para que puedas alquilar y vender tu inmueble en el menor tiempo posible, maximizamos tu tiempo y tu rentabilidad EXPERIENCIA real de muchos años, trabajo transparente y serio. La felicidad con nuestros clientes y la excelencia en nuestro trabajo es la garantía de tu éxito. Si podemos AYUDARLE en algo consulte sin compromiso, nos adaptamos a sus necesidades. Sin moverte de casa! Aprovecha nuestras visitas virtuales y videollamadas y podrás ver la vivienda en directo. ¡BIENVENIDO A LA DIFERENCIA! ""Más info en o en el teléfono 926415076."
"48","Piso en Alquiler en Tomelloso, Ciudad Real Ref: 66596","450","Tomelloso","80","2","1",0,0,0,0,"Cocina equipada
Aire acondicionado","Ascensor
Jardín","REFERENCIA: 66596 Se alquila piso amueblado en Tomelloso . Tiene una superficie de 84 m2, distribuidos en 2 dormitorios, 1 baño, un amplio salón con balcón y cocina. El inmueble dispone de ascensor y plaza de garaje."
"49","Piso en Alquiler en Tomelloso, Ciudad Real Ref: 6619B","450","Tomelloso","80","2","2",0,0,0,0,"Cocina equipada
Aire acondicionado","Jardín","REFERENCIA: 6619B Se alquila estupendo piso amueblado de 2 habitaciones, 2 baños completos, uno en habitación principal. Cocina equipada con todos los electrodomésticos incluido lavavajillas. Suelos de parquet, armarios empotrados, plaza de garaje incluida en el precio. Condiciones: Contrato trabajo, dos últimas nóminas, mes fianza. No se aceptan mascotas"
"50","Estudio en Alquiler en Avenida Antonio Huertas Tomelloso, Ciudad Real Ref: 6651B","350","Tomelloso","60","1","1",1,0,0,0,"Amueblado
Cocina equipada","Ascensor
Jardín","REFERENCIA: 6651B En alquiler apartamento amueblado. Consta de 1 habitación, 1 baño, salón con cocina americana. El inmueble está totalmente amueblado y equipado, incluye una plaza de garaje en el precio. Situado en Avenida Antonio Huertas. Una de las arterias principales de Tomelloso, donde encontrarás restaurantes, cafeterías, supermercados, farmacias, colegios."
"51","Piso en Alquiler en Tomelloso, Ciudad Real Ref: 6649A","400","Tomelloso","80","2","1",0,0,0,1,"Balcón","Cocina equipada
Aire acondicionado","REFERENCIA: 6649A Se alquila piso en Tomelloso, Ciudad Real. Tiene una superficie de 85 m2 que se distribuyen en 2 habitaciones, 1 baño, cocina, salón, una pequeña terraza y balcón. El inmueble es completamente exterior, y dispone de ascensor y plaza de garaje. Está situado en la calle Ángel Izquierdo de Tomelloso, en zona centro, a pocos minutos de Plaza de España y próximo a las Avenidas importantes de la ciudad, teniendo pues una excelente comunicación dentro de la ciudad."
"52","Piso en Alquiler en Almagro Ref: 230805-A","650","Almagro","160","5","2",0,0,0,1,"Terraza","Amueblado
Cocina equipada
Aire acondicionado","Inmobiliaria Doncel, alquila, PISO EN EL CENTRO DE ALMAGRO, sobre parcela de trecientos setenta y un metros cuadrados, se encuentra cercano a comercios, cercano a transporte público, cercano a colegios, cercano al centro, ubicado en planta alta tiene cinco dormitorios y dos baños, un armario empotrado, terraza, la calefacción es eléctrica con bombas de calor, la carpintería exterior interior son de madera, pavimentos cerámicos, incluye garaje y trastero. BUEN ESTADO. ¡¡ Con INMOBILIARIA DONCEL , mayor calidad, mejor servicio, mayor seguridad. Vea su oferta en www.inmobiliariadoncel.com, o contáctenos y le llamamos. !!"
"53","Alquiler casa amueblada terraza Tomelloso Ref: 10747","500","Tomelloso","200","4","1",0,0,1,1,"Balcón
Terraza
Trastero","Amueblado
Cocina equipada","Casa en alquiler cerca de la Avda. Antonio Huertas por lo que múltiples y diversos servicios quedan a un solo paso: cafeterías, colegios, institutos, comercios, etc. Un lugar ideal para los que prefieren tener todo a mano. Cuenta con 160m2 distribuidos en un salón-comedor, cocina amueblada, patio. Cuatro dormitorios, dos baños y un aseo. A parte, también incluye un garaje para dos vehículos. La vivienda se encuentra en un estado óptimo de conservación. Solicite más información y venga a verlo sin compromiso. Si quiere conocer más inmuebles como este no deje de visitar nuestra página web: www.gfima.es Lo que más amo de mi casa es con quien la comparto. Compártela con nosotros."
"54","Ref. B116 se alquila piso planta baja - zona avda 1º de mayo Ref: REF.B116","400","Ctra De Córdoba - Libertad - Puertollano","90","3","1",1,0,0,0,"Amueblado
Cocina equipada","En buen estado","CASAINNOVA GESTIÓN INMOBILIARIA ALQUILA fabuloso piso de planta baja en pleno centro de Puertollano, en zona próxima al centro de salud. El inmueble está situado en una zona tranquila, pero está rodeado de todos los servicios (farmacias, supermercados, comercios...). La vivienda se compone de tres dormitorios, acogedor salón, cocina independiente con patio, y baño completo con bañera. El propietario NO ADMITE MASCOTAS. Le atendemos en calle Ancha 10 de Puertollano, o a través de los teléfonos 926 423 223/657 692 599."
"55","Piso ideal en zona pedrera baja Ref: 324ACR","540","Santa María - Ciudad Real","85","2","1",0,0,0,1,"Terraza","Amueblado
Cocina equipada","Se alquila piso en zona Pedrera Baja. La vivienda está distribuida en salón amplio, terraza, cocina independiente amueblada y equipada, baño completo con bañera, dos dormitorios. Gastos de la comunidad incluidos en el precio. Completamente amueblado y equipado. GESTIONA REAL ESTATE te ofrece todos los servicios necesarios para que puedas alquilar y vender tu inmueble en el menor tiempo posible, maximizamos tu tiempo y tu rentabilidad EXPERIENCIA real de muchos años, trabajo transparente y serio. La felicidad con nuestros clientes y la excelencia en nuestro trabajo es la garantía de tu éxito. Si podemos AYUDARLE en algo consulte sin compromiso, nos adaptamos a sus necesidades. Sin moverte de casa! Aprovecha nuestras visitas virtuales y videollamadas y podrás ver la vivienda en directo. ¡BIENVENIDO A LA DIFERENCIA! ""Más info en o en el teléfono."
